{
  "$schema": "https://json-schema.org/draft/2020-12/schema",
  "$id": "https://oakn.dev/schema/claim-v1.json",
  "title": "OAKN Claim v1",
  "type": "object",
  "required": ["schema_version", "id", "package", "claim_type", "summary", "conditions", "evidence", "provenance", "verification", "license", "lifecycle"],
  "additionalProperties": false,
  "properties": {
    "schema_version": {"const": 1},
    "id": {"type": "string", "format": "uuid"},
    "package": {
      "type": "object",
      "required": ["purl", "version"],
      "additionalProperties": false,
      "properties": {
        "purl": {"type": "string"},
        "version": {"type": "string"},
        "affected": {"type": "string", "pattern": "^vers:", "maxLength": 200}
      }
    },
    "claim_type": {"type": "string"},
    "summary": {"type": "string", "maxLength": 500},
    "conditions": {"type": "array", "items": {"type": "string"}},
    "evidence": {"type": "array", "minItems": 1},
    "provenance": {"type": "object"},
    "verification": {"type": "object"},
    "license": {"type": "object"},
    "lifecycle": {"type": "object"}
  }
}
