{
  "schema_version": 1,
  "id": "6ebd2d62-92f9-46f0-a061-f1e5754bfbc5",
  "package": {
    "purl": "pkg:npm/left-pad@1.3.0",
    "version": "1.3.0"
  },
  "claim_type": "API_BEHAVIOR",
  "summary": "left-pad 1.3.0 adds leading padding until a value reaches the requested width.",
  "conditions": [
    "The package version is exactly 1.3.0.",
    "The target width is greater than the original value length."
  ],
  "evidence": [
    {
      "kind": "git",
      "repository": "https://github.com/stevemao/left-pad",
      "commit_sha": "ff8e7ba8b4122829cf66125ca8445cac7f073bce",
      "path": "README.md",
      "content_sha256": "a3656c49f5e128558086af08bd30c58672db4fb85df0bfa6ad3c8deee4d6a209",
      "package_manifest": {
        "path": "package.json",
        "content_sha256": "1eb356b6e5d3f5568ee627131293fe4ecfac6b8023222573f39aa49e108d42c4"
      }
    }
  ],
  "provenance": {
    "source_url": "https://github.com/stevemao/left-pad/blob/ff8e7ba8b4122829cf66125ca8445cac7f073bce/README.md",
    "retrieved_at": "2026-09-21",
    "source_authority": "maintainer"
  },
  "verification": {
    "source_binding": "verified",
    "source_authority": "asserted",
    "semantic_support": "asserted",
    "executable_verification": "not_run",
    "freshness": "current_at_creation",
    "contradictions": "none_known"
  },
  "license": {
    "source_license": "WTFPL",
    "verbatim": false
  },
  "lifecycle": {
    "state": "active",
    "created_at": "2026-09-21"
  }
}
