{
  "claim_type": "DOCUMENTED_BUG",
  "conditions": [
    "The package version is exactly 44.0.1.",
    "This is a fix-version claim: the vulnerable bundled OpenSSL affects PyPI wheel versions >= 42.0.0, < 44.0.1, and is not present starting with this version."
  ],
  "evidence": [
    {
      "commit_sha": "adaaaed77db676bbaa9d171175db81dce056e2a7",
      "content_sha256": "0306c177b0e07c138d7930b5801413895a5ff56b8ce5d897c8ecf8759466fc00",
      "kind": "git",
      "package_manifest": {
        "content_sha256": "2a80cdb6c962a3c8b140bf0f85baaa781f6e954c36e16a884da9fce5ba6f2890",
        "path": "pyproject.toml"
      },
      "path": "CHANGELOG.rst",
      "repository": "https://github.com/pyca/cryptography"
    }
  ],
  "id": "6e0c02a9-9eb5-4ecd-8226-9a764703f29d",
  "license": {
    "source_license": "Apache-2.0 OR BSD-3-Clause",
    "verbatim": false
  },
  "lifecycle": {
    "created_at": "2026-09-28",
    "state": "active"
  },
  "package": {
    "purl": "pkg:pypi/cryptography@44.0.1",
    "version": "44.0.1"
  },
  "provenance": {
    "retrieved_at": "2026-09-28",
    "source_authority": "official",
    "source_url": "https://github.com/pyca/cryptography/security/advisories/GHSA-79v4-65xg-pq4g"
  },
  "schema_version": 1,
  "summary": "cryptography wheels for versions 42.0.0 through 44.0.0 bundle a statically-linked copy of OpenSSL affected by a security issue disclosed in OpenSSL's 2025-02-11 security advisory (CVE-2024-12797, GHSA-79v4-65xg-pq4g); this only affects users installing prebuilt PyPI wheels, not users building from sdist with their own OpenSSL. Fixed in 44.0.1, which updates the Windows, macOS, and Linux wheels to be compiled against OpenSSL 3.4.1.",
  "verification": {
    "contradictions": "none_known",
    "executable_verification": "not_run",
    "freshness": "current_at_creation",
    "semantic_support": "asserted",
    "source_authority": "asserted",
    "source_binding": "verified"
  }
}
