{
  "claim_type": "DOCUMENTED_BUG",
  "conditions": [
    "The package version is exactly 3.1.3.",
    "The application reads the session using key-only operations such as `in` or `len` without also reading a value."
  ],
  "evidence": [
    {
      "commit_sha": "22d924701a6ae2e4cd01e9a15bbaf3946094af65",
      "content_sha256": "21cb6ce7d10cad9a24899be759177d7633b36f6f6c29b6d2eaeb763afd47630a",
      "kind": "git",
      "package_manifest": {
        "content_sha256": "ea0777ce44101efe5edd8c152aceef898acf9a98c8bd840ad98473611a573948",
        "path": "pyproject.toml"
      },
      "path": "CHANGES.rst",
      "repository": "https://github.com/pallets/flask"
    }
  ],
  "id": "c690841c-aaf4-42e0-a0d4-12eed5fe3c5e",
  "license": {
    "source_license": "BSD-3-Clause",
    "verbatim": false
  },
  "lifecycle": {
    "created_at": "2026-09-28",
    "state": "active"
  },
  "package": {
    "purl": "pkg:pypi/flask@3.1.3",
    "version": "3.1.3"
  },
  "provenance": {
    "retrieved_at": "2026-09-28",
    "source_authority": "maintainer",
    "source_url": "https://github.com/pallets/flask/blob/22d924701a6ae2e4cd01e9a15bbaf3946094af65/CHANGES.rst"
  },
  "schema_version": 1,
  "summary": "Flask before 3.1.3 does not mark the session as accessed for operations that only access session keys (not values), such as `in` and `len`, causing Vary: Cookie to be missing from some responses that depend on the session cookie (GHSA-68rp-wp8r-4726). Flask 3.1.3 fixes this.",
  "verification": {
    "contradictions": "none_known",
    "executable_verification": "not_run",
    "freshness": "current_at_creation",
    "semantic_support": "asserted",
    "source_authority": "asserted",
    "source_binding": "verified"
  }
}
