{
  "claim_type": "DOCUMENTED_BUG",
  "conditions": [
    "The package version is exactly 3.0.3.",
    "This is a fix-version claim: the described debugger trusted-hosts issue affects versions before 3.0.3, and is not present starting with this version."
  ],
  "evidence": [
    {
      "commit_sha": "f9995e967979eb694d6b31536cc65314fd7e9c8c",
      "content_sha256": "1406c8871216f0278ff0e8f487879939c747131372dda3275cc0586b532f4f6d",
      "kind": "git",
      "package_manifest": {
        "content_sha256": "ee04b969903650b9c7828582f7b34831c0931a91b92415c26e26ccc10e509490",
        "path": "pyproject.toml"
      },
      "path": "CHANGES.rst",
      "repository": "https://github.com/pallets/werkzeug"
    }
  ],
  "id": "d417f5df-dcc5-4907-bf26-f6c26b1a75ae",
  "license": {
    "source_license": "BSD-3-Clause",
    "verbatim": false
  },
  "lifecycle": {
    "created_at": "2026-09-28",
    "state": "active"
  },
  "package": {
    "purl": "pkg:pypi/werkzeug@3.0.3",
    "version": "3.0.3"
  },
  "provenance": {
    "retrieved_at": "2026-09-28",
    "source_authority": "official",
    "source_url": "https://github.com/pallets/werkzeug/security/advisories/GHSA-2g68-c3qc-8985"
  },
  "schema_version": 1,
  "summary": "Werkzeug before 3.0.3 has a debugger remote-execution risk (CVE-2024-34069, GHSA-2g68-c3qc-8985): the debugger did not restrict which hosts could make requests, so an attacker who gets a developer to visit an attacker-controlled domain/subdomain and enter the PIN could gain code execution even when the debugger only listens on localhost. Fixed in 3.0.3 by only allowing localhost, .localhost, 127.0.0.1, or the app's hostname to make debugger requests.",
  "verification": {
    "contradictions": "none_known",
    "executable_verification": "not_run",
    "freshness": "current_at_creation",
    "semantic_support": "asserted",
    "source_authority": "asserted",
    "source_binding": "verified"
  }
}
