{
  "claim_type": "DOCUMENTED_BUG",
  "conditions": [
    "The package version is exactly 2.21.4.",
    "This is a fix-version claim: the described @JsonView bypass affects versions >= 2.21.0, < 2.21.4, and is not present starting with this version."
  ],
  "evidence": [
    {
      "commit_sha": "dd72fa6c89b5cea6c4eba5a8604f248bbc5d93e5",
      "content_sha256": "0766ae9736b0a785f2d328c5ee7fa79b96ad64031a2572d7e805c2e320021a8f",
      "kind": "git",
      "package_manifest": {
        "content_sha256": "58c9c87c3d46ec8fb57d855fc675185e01147f3a9a415a92a2e464a5c02b9cec",
        "path": "pom.xml"
      },
      "path": "release-notes/VERSION-2.x",
      "repository": "https://github.com/FasterXML/jackson-databind"
    }
  ],
  "id": "6eb28a49-56ee-4534-910d-f44b193207ec",
  "license": {
    "source_license": "Apache-2.0",
    "verbatim": false
  },
  "lifecycle": {
    "created_at": "2026-09-28",
    "state": "active"
  },
  "package": {
    "purl": "pkg:maven/com.fasterxml.jackson.core/jackson-databind@2.21.4",
    "version": "2.21.4"
  },
  "provenance": {
    "retrieved_at": "2026-09-28",
    "source_authority": "official",
    "source_url": "https://github.com/FasterXML/jackson-databind/security/advisories/GHSA-5hh8-q8hv-fr38"
  },
  "schema_version": 1,
  "summary": "jackson-databind before 2.21.4 (2.21.0-2.21.3) can bypass @JsonView view-based access control for setterless Collection/Map creator properties: BeanDeserializer._deserializeUsingPropertyBased only checked prop.visibleInView(activeView) for creator properties, not the regular property-buffering branch, so a view-restricted setterless collection/map can be populated from untrusted JSON despite the active view excluding it (GHSA-5hh8-q8hv-fr38). Fixed in 2.21.4.",
  "verification": {
    "contradictions": "none_known",
    "executable_verification": "not_run",
    "freshness": "current_at_creation",
    "semantic_support": "asserted",
    "source_authority": "asserted",
    "source_binding": "verified"
  }
}
