{
  "claim_type": "DOCUMENTED_BUG",
  "conditions": [
    "The package version is exactly 1.2.6.",
    "This is a fix-version claim: the described prototype pollution affects versions >= 1.0.0, < 1.2.6, and is not present starting with this version."
  ],
  "evidence": [
    {
      "commit_sha": "7efb22a518b53b06f5b02a1038a88bd6290c2846",
      "content_sha256": "48ab32c4ba79cde9a1b1236437942567f97b8eac7ce17013b83b548c620db652",
      "kind": "git",
      "package_manifest": {
        "content_sha256": "14726723d668e63988f4f8cdc48b2224bd54011166fc3733c0b09177ce38f6ef",
        "path": "package.json"
      },
      "path": "index.js",
      "repository": "https://github.com/minimistjs/minimist"
    }
  ],
  "id": "915e289b-d58d-46ef-8756-97cee0abaa12",
  "license": {
    "source_license": "MIT",
    "verbatim": false
  },
  "lifecycle": {
    "created_at": "2026-09-28",
    "state": "active"
  },
  "package": {
    "purl": "pkg:npm/minimist@1.2.6",
    "version": "1.2.6"
  },
  "provenance": {
    "retrieved_at": "2026-09-28",
    "source_authority": "official",
    "source_url": "https://github.com/advisories/GHSA-xvch-5gv4-984h"
  },
  "schema_version": 1,
  "summary": "minimist before 1.2.6 is vulnerable to prototype pollution: parsing a crafted argument like --__proto__.x=y or a constructor key can pollute Object.prototype, affecting any app that passes attacker-controlled argv-like arrays through minimist (CVE-2021-44906, GHSA-xvch-5gv4-984h). Fixed in 1.2.6 by rejecting __proto__ keys and constructor-function keys during key assignment, and resetting known prototype objects mid-path to plain objects/arrays.",
  "verification": {
    "contradictions": "none_known",
    "executable_verification": "not_run",
    "freshness": "current_at_creation",
    "semantic_support": "asserted",
    "source_authority": "asserted",
    "source_binding": "verified"
  }
}
