{
  "claim_type": "API_BEHAVIOR",
  "conditions": [
    "The package version is exactly 4.0.0.",
    "The concurrency argument is a positive integer or positive Infinity."
  ],
  "evidence": [
    {
      "commit_sha": "38a6773e552d24f4c9eb2d79d57b6cff017c587d",
      "content_sha256": "eed2a19777099d88a898c580c8b3f8e071671ab2121ac1cb65330dc0ed9e7882",
      "kind": "git",
      "package_manifest": {
        "content_sha256": "71b014415b5b254af73a26d5ffdb0757f919587de66b7984567aff2167c1d5d6",
        "path": "package.json"
      },
      "path": "readme.md",
      "repository": "https://github.com/sindresorhus/p-limit"
    },
    {
      "commit_sha": "38a6773e552d24f4c9eb2d79d57b6cff017c587d",
      "content_sha256": "f80d1e76df221c95ac831ed00ad0aac83496fd0b2bc98d3d0e4296e6e8f6b2e9",
      "kind": "git",
      "package_manifest": {
        "content_sha256": "71b014415b5b254af73a26d5ffdb0757f919587de66b7984567aff2167c1d5d6",
        "path": "package.json"
      },
      "path": "index.js",
      "repository": "https://github.com/sindresorhus/p-limit"
    }
  ],
  "id": "3ce78a31-cdca-42f2-91eb-f9d471375d81",
  "license": {
    "source_license": "MIT",
    "verbatim": false
  },
  "lifecycle": {
    "created_at": "2026-09-23",
    "state": "active"
  },
  "package": {
    "purl": "pkg:npm/p-limit@4.0.0",
    "version": "4.0.0"
  },
  "provenance": {
    "retrieved_at": "2026-09-23",
    "source_authority": "maintainer",
    "source_url": "https://github.com/sindresorhus/p-limit/blob/38a6773e552d24f4c9eb2d79d57b6cff017c587d/readme.md"
  },
  "schema_version": 1,
  "summary": "p-limit 4.0.0 pLimit(concurrency) returns a limit function that applies the configured concurrency limit to promise-returning or async work.",
  "verification": {
    "contradictions": "none_known",
    "executable_verification": "not_run",
    "freshness": "current_at_creation",
    "semantic_support": "asserted",
    "source_authority": "asserted",
    "source_binding": "verified"
  }
}
